{
  "schemaVersion": "jobservatory.serving-index-manifest.v1",
  "generatedAt": "2026-08-25T00:35:57+00:00",
  "serviceVersion": "jobservatory-search-api-v1",
  "route": "/api/v1/search",
  "index": {
    "path": "/api/search/index-v1.json",
    "sha256": "sha256:81b762bf0d05050fd6684ddbc1dcf6e5c95e1ad9f9b0469b3041f04c08791d89",
    "bytes": 2702747,
    "documents": 2698,
    "indexBuildVersion": "jobservatory-serving-index-1.1.0"
  },
  "model": {
    "modelId": "bm25-production-baseline-1.0.0",
    "algorithm": "Okapi BM25",
    "parameters": {
      "k1": 1.2,
      "b": 0.75
    }
  },
  "corpus": {
    "schemaVersion": "0.2.0",
    "observations": 2698,
    "descriptionPolicy": "metadata-and-evidence-only",
    "contentSha256": "sha256:57c8738856e59a43950f20cbfd2fc2a505d632a8a1ae0081134b6b98493ca811",
    "generatedAt": "2026-08-25T00:35:57+00:00"
  },
  "promotion": {
    "status": "baseline_only",
    "reason": "The learned candidate remains rejected; production serves the explicit BM25 baseline until held-out promotion evidence exists."
  }
}
